Book_name,Book_url,Author,ISBN-10,Year,Pages,Language,Category,Book_description
Exploring Blazor,http://www.allitebooks.com/exploring-blazor/, Warren Gay, 9781484217382, 2019, 212, English, Programming,"Book Description:        You have a Pi 2, but what exactly can you do with it? This book takes you on a tour of the Pi 2 hardware and all of the fantastic things that you can do to create innovative and useful projects with your Pi. Start with creating a workstation that does actual work, and move into installing a custom kernel, creating a clock, learning the ins and outs of the GPIO interface, and pick up some useful C++ skills along the way.  Warren Gay, author of Mastering the Raspberry Pi, takes you through a set of experiments to show just what the Pi 2 is capable of and how you can use it to make your own fantastic creations.   What You Will Learn:    How to create an experimenter’s workstation for the Pi 2, complete with breadboard and even Arduino All the details of GPIO, including a custom command for working with it Useful projects like a general purpose clock and the PiSpy Quick intro to C++ for the Pi How to make a multi-core webserver    Who this book is for:  Intermediate electronics enthusiasts and Pi fans, makers, students, teachers, and everyone who wants to know how to make the Pi really work."
C Programming for the PIC Microcontroller,http://www.allitebooks.com/c-programming-for-the-pic-microcontroller/," Dharanitharan Ganesan, Subhashini Chellappan", 1484248902, 2019, 247, English, MongoDB,"Book Description:         Get the most out of MongoDB using a problem-solution approach. This book starts with recipes on the MongoDB query language, including how to query various data structures stored within documents. These self-contained code examples allow you to solve your MongoDB problems without fuss.   MongoDB Recipes describes how to use advanced querying in MongoDB, such as indexing and the aggregation framework. It demonstrates how to use the Compass function, a GUI client interacting with MongoDB, and how to apply data modeling to your MongoDB application. You’ll see recipes on the latest features of MongoDB 4 allowing you to manage data in an efficient manner using MongoDB.   What You Will Learn    Work with the MongoDB document model Design MongoDB schemas Use the MongoDB query language Harness the aggregation framework Create replica sets and sharding in MongoDB    Who This Book Is For  Developers and professionals who work with MongoDB."
C Programming for the PIC Microcontroller,http://www.allitebooks.com/c-programming-for-the-pic-microcontroller/," Navin Sabharwal, Shakuntala Gupta Edward", 1484255364, 2019, 347, English, Cloud Computing,"Book Description:        Discover the methodologies and best practices for getting started with Google Cloud Platform relational services – CloudSQL and CloudSpanner.  The book begins with the basics of working with the Google Cloud Platform along with an introduction to the database technologies available for developers from Google Cloud.  You’ll then take an in-depth hands on journey into Google CloudSQL and CloudSpanner, including choosing the right platform for your application needs, planning, provisioning, designing and developing your application.   Sample applications are given that use Python to connect to CloudSQL and CloudSpanner, along with helpful features provided by the engines. You”ll also implement practical best practices in the last chapter. Hands On Google Cloud SQL and Cloud Spanner is a great starting point to apply GCP data offerings in your technology stack and the code used allows you to try out the examples and extend them in interesting ways.   What You’ll Learn      Get started with Big Data technologies on the Google Cloud Platform   Review CloudSQL and Cloud Spanner  from basics to administration  Apply best practices and use Google’s CloudSQL and CloudSpanner offering Work with code in Python notebooks and scripts   Who This Book Is For   Application architects, database architects, software developers, data engineers, cloud architects."
Exploring Blazor,http://www.allitebooks.com/exploring-blazor/, Rap Payne, 1484251806, 2019, 309, English, Programming,"Book Description:        Create iOS and Android apps with Flutter using just one codebase.  App development on multiple platforms has historically been difficult and complex. This book breaks down complex concepts and tasks into easily digestible segments with examples, pictures, and hands-on labs with starters and solutions. In doing so, you’ll develop a basic understanding of the Dart programming language; the entire Flutter development toolchain; the differences between stateful and stateless widgets; and a working knowledge of the architecture of apps. All the most important parts of app development with Flutter are covered in this book. Work with themes and styles. Develop custom widgets. Teach your app to respond to gestures like taps, swipes, and pinches. Design, create and control the layout of your app. Create tools to handle form data entry from users. And ultimately create killer multiscreen apps with navigation, menus, and tabs. Flutter is Google’s new framework for creating mobile apps that run on iOS and Android phones both.You had to be a super-developer to write apps for iOS or Android alone. But writing for both? Forget about it! You had to be familiar with Swift, Java/Kotlin, Xcode, Eclipse, and a bunch of other technologies simultaneously. Beginning App Development with Flutter simplifies the entire process. What You’ll Learn   Get the most out of great Flutter widgets Create custom widgets, both stateless and stateful Exercise expert control over your Flutter layouts Make your app respond to gestures like swiping, pinching and tapping Initiate async Ajax calls to RESTful APIs ― including Google Firebase!   Who This Book Is For  Developers who have coded in Java, C#, C++, or any similar language. It brings app development within the reach of younger developers, so STEM groups are likely to pick up the technology. Managers, product owners, and business analysts need to understand Flutter’s capabilities."
Exploring Blazor,http://www.allitebooks.com/exploring-blazor/, Taurius Litvinavicius, 1484254457, 2019, 199, English, C#,"Book Description:        Build and develop web applications with Blazor in C#. This book will cover all three types of Blazor – server-side, client-side, and hosted along with other features of the technology. You’ll see that Blazor is a web UI framework based on C#, Razor, and HTML and how it runs front-end logic using C# either on the server or on the browser using WebAssembly. The author starts by introducing WebAssembly and gives an overview of Blazor along with its various categories. Next, you’ll get started with Blazor where you learn the basics, including Razor syntax implementation. Here you will go over the major differences between Blazor and Razor and how the syntax works. A demo of the layout and navigation for server-side Blazor is followed by usage of Razor syntax to control an application in client-side Blazor. Further, you will go through the project layout, navigation, and routes for the API. Here, you will understand how to access the API from the front end and use the shared library for different models. Moving forward, you will discover how Blazor works with storage, files, and JavaScript. Finally, you will create web applications in Blazor using practical implementations and real-life scenarios for server-side, client-side, and hosted applications. After reading this book you will be able to build web applications with Blazor in C# and .NET Core 3.0. What You Will Learn  Bind one-way and two-way data Combine Blazor and JavaScript Understand layout in server-side and client-side applications Execute the general syntax in Razor  Who This Book Is For C# and .NET Core developers"
Exploring Blazor,http://www.allitebooks.com/exploring-blazor/," Avinash Singh, Rahul Sharma", 1484254570, 2019, 321, English, Software,"Book Description:        Build an in-depth understanding of the Istio service mesh and see why a service mesh is required for a distributed application. This book covers the Istio architecture and its features using a hands-on approach with language-neutral examples. To get your Istio environment up and running, you will go through its setup and learn the concepts of control plane and data plane. You will become skilled with the new concepts and apply them with best practices to continuously deliver applications. What You Will Learn  Discover the Istio architecture components and the Envoy proxy Master traffic management for service routing and application deployment Build application resiliency using timeout, circuit breakers, and connection pools Monitor using Prometheus and Grafana Configure application security  Who This Book Is For  Developers and project managers who are trying to run their application using Kubernetes. The book is not specific for any programming language even though all examples will be in Java or Python."
Exploring Blazor,http://www.allitebooks.com/exploring-blazor/," Chaminda Chandrasekara, Pushpa Herath", 1484254244, 2019, 280, English, Cloud Computing,"Book Description:        Use Azure Repos to manage your code in both centralized and distributed version control systems. This book will show you how to work with Team Foundation Version Control (TFVC) and distributed version control (Git), while exploring their best practices.  You’ll start with an introduction to Azure Repos, focusing on TFVC and Git, and then gradually transition to hands on lessons of working with TVFC. Next, you’ll see how to set up and work with TFVC branches and tracking systems followed by usage of command line and security in TFVC Repos.   Create and work on Git Repos in Azure DevOps and use branching with Azure Git Repos and Git command line in Visual Studio and vscode. The book then explores security in Git Repos and advanced options you can use to import from external Repos. With Hands-on Azure Repos as your guide, you’ll be able to work with these version control tools on any platform and with any language.   What You’ll Learn    Integrate Azure Repos with Azure Boards to enable tracking work with code. Create guidelines to tackle difficult situations in using Azure Repos Clone Azure Repo to local using Visual Studio and vscode Work with shelvesets, code reviews and lock types  Perform activities using REST API with Azure Repos   Who This Book Is For    Software developers, tech leads and architects."
Exploring Blazor,http://www.allitebooks.com/exploring-blazor/," Gregory Smith, Kelvin Sung", 1484254422, 2019, 403, English, Game Programming,"Book Description:        Use Unity-based examples to understand fundamental mathematical concepts and see how they are applied when building modern video game functionality. You will gain the theoretical foundation you need, and you will know how to examine and modify an implementation. This book covers points in a 3D Cartesian coordinate system, and then discusses vectors and the details of dot and cross products. Basic mathematical foundations are illustrated through Unity-based example implementations. Also provided are examples showing how the concepts are applied when implementing video game functionality, such as collision support, motion simulations, autonomous behaviors, shadow approximations, and reflection off arbitrary walls. Throughout this book, you learn and examine the concepts and their applications in a game engine. What You Will Learn  Understand the basic concepts of points and vectors and their applications in game development Apply mathematical concepts to modern video game functionality, such as spherical and box colliders Implement autonomous behaviors, including following way points, facing a target, chasing an object, etc.  Who This Book is For Beginners, and those interested in the implementation of interactive games, who need a basic mathematical background or a refresher with modern examples"
Exploring Blazor,http://www.allitebooks.com/exploring-blazor/, Ayende Rahien, 1933988606, 2019, 352, English, C#,"Book Description:        A general-purpose language like C# is designed to handle all programming tasks. By contrast, the structure and syntax of a Domain-Specific Language are designed to match a particular applications area. A DSL is designed for readability and easy programming of repeating problems. Using the innovative Boo language, it’s a breeze to create a DSL for your application domain that works on .NET and does not sacrifice performance. DSLs in Boo shows you how to design, extend, and evolve DSLs for .NET by focusing on approaches and patterns. You learn to define an app in terms that match the domain, and to use Boo to build DSLs that generate efficient executables. And you won’t deal with the awkward XML-laden syntax many DSLs require. The book concentrates on writing internal (textual) DSLs that allow easy extensibility of the application and framework. And if you don’t know Boo, don’t worry-you’ll learn right here all the techniques you need."
Exploring Blazor,http://www.allitebooks.com/exploring-blazor/, Gavin M. Roy, 1617291005, 2017, 264, English, Services & APIs,Book Description:        RabbitMQ in Depth is a practical guide to building and maintaining message-based applications. This book provides detailed coverage of RabbitMQ with an emphasis on why it works the way it does.
Exploring Blazor,http://www.allitebooks.com/exploring-blazor/, David Both, 1484254546, 2020, 583, English, Linux & Unix,"Book Description:        Experience an in-depth exploration of logical volume management and the use of file managers to manipulate files and directories and the critical concept that, in Linux, everything is a file and some fun and interesting uses of the fact that everything is a file. This book builds upon the skills you learned in Volume 1 of this course and it depends upon the virtual network and virtual machine created there. More experienced Linux users can begin with this volume and download the assigned script that will set up the VM for the start of Volume 2. Instructions with the script will provide specifications for configuration of the virtual network and the virtual machine. Refer to the volume overviews in the book’s introduction to select the volume of this course most appropriate for your current skill level. You’ll see how to manage and monitor running processes, discover the power of the special filesystems, monitor and tune the kernel while it is running – without a reboot. You’ll then turn to regular expressions and the power that using them for pattern matching can bring to the command line, and learn to manage printers and printing from the command line and unlock the secrets of the hardware on which your Linux operating system is running. Experiment with command line programming and how to automate various administrative tasks, networking, and the many services that are required in a Linux system. Use the logs and journals to look for clues to problems and confirmation that things are working correctly, and learn to enhance the security of your Linux systems and how to perform easy local and remote backups. What You Will Learn  Understand Logical Volume Management, using file managers, and special filesystems Exploit everything in a file Perform command line programming and basic automation Configure printers and manage other hardware Manage system services with systemd, user management, security, and local and remote backups using simple and freely available tools  Who This Book Is For Anyone who wants to continue to learn Linux in depth as an advanced user and system administrator at the command line while using the GUI desktop to leverage productivity."
Exploring Blazor,http://www.allitebooks.com/exploring-blazor/," Marko Bonaci, Petar Zecevic", 9781617292606, 2016, 472, English, Programming,Book Description:        Spark in Action teaches you the theory and skills you need to effectively handle batch and streaming data using Spark. Fully updated for Spark 2.0.
Learn Java with Math,http://www.allitebooks.com/learn-java-with-math/, Ron Dai, 148425208X, 2019, 231, English, Java,"Book Description:        There are many good Java programming books on the market, but it’s not easy to find one fit for a beginner. This book simplifies the complexity of Java programming and guides you through the journey to effectively work under the hood.   You’ll start with the fundamentals of Java programming and review how it integrates with basic mathematical concepts through many practical examples. You’ll witness firsthand how Java can be a powerful tool or framework in your experimentation work.   Learn Java with Math reveals how a strong math foundation is key to learning programming design. Using this as your motivation, you’ll be programming in Java in no time.    What You’ll Learn     Explore Java basics Program with Java using fun math-inspired examples Work with Java variables and algorithms Review I/O, loops, and control structures Use projects such as the Wright brothers coin flip game   Who This Book Is For   Those new to programming and Java but have some background in mathematics and are at least comfortable with using a computer."
Learn Java with Math,http://www.allitebooks.com/learn-java-with-math/, Connor P. Milliken, 148425354X, 2020, 332, English, Python,"Book Description:        Immerse yourself in learning Python and introductory data analytics with this book’s project-based approach. Through the structure of a ten-week coding bootcamp course, you’ll learn key concepts and gain hands-on experience through weekly projects. Each chapter in this book is presented as a full week of topics, with Monday through Thursday covering specific concepts, leading up to Friday, when you are challenged to create a project using the skills learned throughout the week. Topics include Python basics and essential intermediate concepts such as list comprehension, generators and iterators, understanding algorithmic complexity, and data analysis with pandas. From beginning to end, this book builds up your abilities through exercises and challenges, culminating in your solid understanding of Python. Challenge yourself with the intensity of a coding bootcamp experience or learn at your own pace. With this hands-on learning approach, you will gain the skills you need to jumpstart a new career in programming or further your current one as a software developer. What You Will Learn  Understand beginning and more advanced concepts of the Python language Be introduced to data analysis using pandas, the Python Data Analysis library Walk through the process of interviewing and answering technical questions Create real-world applications with the Python language Learn how to use Anaconda, Jupyter Notebooks, and the Python Shell    Who This Book Is For    Those trying to jumpstart a new career into programming, and those already in the software development industry and would like to learn Python programming."
Learn Java with Math,http://www.allitebooks.com/learn-java-with-math/, Gerard Gallant, 1617295744, 2019, 448, English, C & C++,"Book Description:        WebAssembly in Action introduces the WebAssembly stack and walks you through the process of writing and running browser-based applications. Expert developer Gerard Gallant gives you a firm foundation of the structure of a module, HTML basics, JavaScript Promises, and the WebAssembly JavaScript API."
Learn Java with Math,http://www.allitebooks.com/learn-java-with-math/, Lam Thuy Vo, 1593279167, 2019, 208, English, Programming,"Book Description:        BuzzFeed News Senior Reporter Lam Thuy Vo explains how to mine, process, and analyze data from the social web in meaningful ways with the Python programming language. Did fake Twitter accounts help sway a presidential election? What can Facebook and Reddit archives tell us about human behavior? In Mining Social Media, senior BuzzFeed reporter Lam Thuy Vo shows you how to use Python and key data analysis tools to find the stories buried in social media. Whether you’re a professional journalist, an academic researcher, or a citizen investigator, you’ll learn how to use technical tools to collect and analyze data from social media sources to build compelling, data-driven stories. Learn how to: •  Write Python scripts and use APIs to gather data from the social web •  Download data archives and dig through them for insights •  Inspect HTML downloaded from websites for useful content •  Format, aggregate, sort, and filter your collected data using Google Sheets •  Create data visualizations to illustrate your discoveries •  Perform advanced data analysis using Python, Jupyter Notebooks, and the pandas library •  Apply what you’ve learned to research topics on your own Social media is filled with thousands of hidden stories just waiting to be told. Learn to use the data-sleuthing tools that professionals use to write your own data-driven stories."
Learn Java with Math,http://www.allitebooks.com/learn-java-with-math/, Dirk Strauss, 1484254481, 2019, 267, English, Software,"Book Description:        Know how to use the features of Visual Studio 2019 and utilize the IDE correctly to become your one-stop solution for creating quality code. Learn what’s new in VS 2019 and explore the existing features of Visual Studio so you can use them more efficiently.  Getting Started with Visual Studio 2019 begins with an overview of Visual Studio and explores new features such as Visual Studio Live Share, Visual Studio Search, Solution Filters, and Intellicode. Author Dirk Strauss teaches you how to create project templates, write code snippets, and manage NuGet packages. You will learn how to: debug your code using breakpoints and step into specific methods, use data tips, and utilize the DebuggerDisplay attribute. You will then move on to learn unit testing and explore the tools provided by Visual Studio to create and run unit tests. The book also covers source control integration in Visual Studio and how to use GitHub to implement a source control strategy in your code.   What You Will Learn   Create and use code snippets in Visual Studio 2019 Utilize diagnostic tools and the Immediate window for code debugging Generate unit tests with IntelliTest Use NuGet in applications Create and handle pull requests   Who This Book Is For   Beginners and software developers working on the .NET stack"
Learn Java with Math,http://www.allitebooks.com/learn-java-with-math/, Akos Hochrein, 1484253574, 2019, 166, English, Python,"Book Description:        Explore microservices using the Python-based Django framework and review the benefits and drawbacks of them. This book will examine what microservices look like, how they talk to each other, and how they are crafted using the Python programming language and the Django web framework. You’ll start by understanding what the key differences are between microservices and monolithic architectures. The book then does a deep dive into how microservices are built and what common models have emerged in our industry. You’ll also take an extensive look at communication and ownership patterns and examine methodologies to speed up your architecture evolution by writing less but more distributed code using the Python programming language and the Django web framework. By the end of the book, you’ll have a solid understanding of microservices architectures. Armed with a comprehensive and solid toolset, you can begin working toward systems that are more scalable, resilient, and maintainable. What You’ll Learn  Understand the benefits and drawbacks of adopting microservices Design systems and architecture for resiliency and distributed ownership Work with tools for scaling distributed system both in technical and organizational dimensions Examine the essentials of the Django web framework"
Learn Java with Math,http://www.allitebooks.com/learn-java-with-math/, Sulaymon Eshkabilov, 1484250605, 2019, 524, English, Programming,"Book Description:        Employ essential and hands-on tools and functions of the MATLAB and Simulink packages, which are explained and demonstrated via interactive examples and case studies. This book contains dozens of simulation models and solved problems via m-files/scripts and Simulink models which help you to learn programming and modeling essentials. You’ll become efficient with many of the built-in tools and functions of MATLAB/Simulink while solving engineering and scientific computing problems.  Beginning MATLAB and Simulink explains various practical issues of programming and modelling in parallel by comparing MATLAB and Simulink. After reading and using this book, you’ll be proficient at using MATLAB and applying the source code from the book’s examples as templates for your own projects in data science or engineering.  What You Will Learn   Get started using MATLAB and Simulink Carry out data visualization with MATLAB Gain the programming and modeling essentials of MATLAB Build a GUI with MATLAB Work with integration and numerical root finding methods Apply MATLAB to differential equations-based models and simulations Use MATLAB for data science projects    Who This Book Is For  Engineers, programmers, data scientists, and students majoring in engineering and scientific computing."
