Book_name,Book_url,Author,ISBN-10,Year,Pages,Language,Category,Book_description
"Mastering 3D Printing, 2nd Edition",http://www.allitebooks.com/mastering-3d-printing-2nd-edition/, Philip Mason, 1484259246, 2020, 338, English, Software,"Book Description:        Customize the SAS Stored Process web application to create amazing tools for end users. This book shows you how to use stored processes―SAS programs stored on a server and executed as required by requesting applications. Never before have there been so many ways to turn data into information and build applications with SAS. This book teaches you how to use the web technologies that you frequently see used on impressive websites. By using SAS Stored Processes, you will be able to build applications that exploit CSS, JavaScript, and HTML libraries and enable you to build powerful and impressive web applications using SAS as the backend. While this approach is not common with SAS users, some have had amazing results. People who have SAS skills usually do not have web development skills, and those with web development skills usually do not have SAS skills. Some people have both skills but are unaware of how to connect them with the SAS Stored Process web application. This book shows you how to leverage your skills for success. What You Will Learn  Know the benefits of stored processes Write your own tools in SAS Make a stored process generate its own HTML menu Pass data between stored processes Use stored processes to generate pure JavaScript Utilize data generated by SAS Convert a SAS program into a stored process  Who This Book Is For SAS programmers looking to improve their existing programming skills to develop web applications, and programming managers who want to make better use of the SAS software they already license"
"Mastering 3D Printing, 2nd Edition",http://www.allitebooks.com/mastering-3d-printing-2nd-edition/, Dan Sullivan, 1119618436, 2020, 352, English, Certification,"Book Description:        The proven Study Guide that prepares you for this new Google Cloud exam The Google Cloud Certified Professional Data Engineer Study Guide, provides everything you need to prepare for this important exam and master the skills necessary to land that coveted Google Cloud Professional Data Engineer certification. Beginning with a pre-book assessment quiz to evaluate what you know before you begin, each chapter features exam objectives and review questions, plus the online learning environment includes additional complete practice tests. Written by Dan Sullivan, a popular and experienced online course author for machine learning, big data, and Cloud topics, Google Cloud Certified Professional Data Engineer Study Guide is your ace in the hole for deploying and managing analytics and machine learning applications. •    Build and operationalize storage systems, pipelines, and compute infrastructure •    Understand machine learning models and learn how to select pre-built models •    Monitor and troubleshoot machine learning models •    Design analytics and machine learning applications that are secure, scalable, and highly available. This exam guide is designed to help you develop an in depth understanding of data engineering and machine learning on Google Cloud Platform."
"Mastering 3D Printing, 2nd Edition",http://www.allitebooks.com/mastering-3d-printing-2nd-edition/, Hannah Stepanek, 148425838X, 2020, 197, English, Python,"Book Description:        Understand and implement big data analysis solutions in pandas with an emphasis on performance. This book strengthens your intuition for working with pandas, the Python data analysis library, by exploring its underlying implementation and data structures. Thinking in Pandas introduces the topic of big data and demonstrates concepts by looking at exciting and impactful projects that pandas helped to solve. From there, you will learn to assess your own projects by size and type to see if pandas is the appropriate library for your needs. Author Hannah Stepanek explains how to load and normalize data in pandas efficiently, and reviews some of the most commonly used loaders and several of their most powerful options. You will then learn how to access and transform data efficiently, what methods to avoid, and when to employ more advanced performance techniques. You will also go over basic data access and munging in pandas and the intuitive dictionary syntax. Choosing the right DataFrame format, working with multi-level DataFrames, and how pandas might be improved upon in the future are also covered. By the end of the book, you will have a solid understanding of how the pandas library works under the hood. Get ready to make confident decisions in your own projects by utilizing pandas―the right way. What You Will Learn  Understand the underlying data structure of pandas and why it performs the way it does under certain circumstances Discover how to use pandas to extract, transform, and load data correctly with an emphasis on performance Choose the right DataFrame so that the data analysis is simple and efficient. Improve performance of pandas operations with other Python libraries    Who This Book Is For  Software engineers with basic programming skills in Python keen on using pandas for a big data analysis project. Python software developers interested in big data."
"Mastering 3D Printing, 2nd Edition",http://www.allitebooks.com/mastering-3d-printing-2nd-edition/, Adam Freeman, 1484254392, 2020, 1400, English, ASP.NET,"Book Description:        This bestselling comprehensive guide to ASP.NET Core is the only book you need for ASP.NET Core development. Period. Professional developers will produce leaner applications for the ASP.NET Core platform using the guidance in this full-color book, now in its 8th edition and updated for ASP.NET Core 3. It contains detailed explanations of the ASP.NET Core platform and the application frameworks it supports. This edition puts ASP.NET Core 3 into context and dives deep into the tools and techniques required to build modern, extensible, web applications. New features and capabilities such as MVC 3, Razor Pages, Blazor Server, and Blazor WebAssembly are covered, along with demonstrations of how they are applied. ASP.NET Core 3 is the latest evolution of Microsoft’s ASP.NET web platform and provides a “host-agnostic” framework and a high-productivity programming model that promotes cleaner code architecture, test-driven development, and powerful extensibility. Best-selling author Adam Freeman has thoroughly revised this market-leading book and explains how to get the most from ASP.NET Core 3. He starts with the nuts-and-bolts topics, teaching you about middleware components, built-in services, request model binding, and more. As you gain knowledge and confidence, he introduces increasingly more complex topics and advanced features, including endpoint routing and dependency injection. He goes in depth to give you the knowledge you need. This book follows the same format and style as the popular previous editions but brings everything up-to-date for the new ASP.NET Core 3 release and broadens the focus to include the entire ASP.NET Core platform. You will appreciate the fully worked case study of a functioning ASP.NET Core application that you can use as a template for your own projects. What You Will Learn  Build a solid foundation and skill set for working with the entire ASP.NET Core platform Apply the new ASP.NET Core 3 features in your developer environment See how to create RESTful web services, web applications, and client-side applications Build on your existing knowledge to get up and running with new programming models quickly and effectively  Who This Book Is For This book is for Microsoft developers and assumes a basic knowledge of web development and C#. While written for professionals who want to incorporate the latest improvements and functionality of ASP.NET Core 3 into their own projects, it also serves as an in-depth and complete reference on the topic. Beginners with some background in Microsoft web development will also benefit from the comprehensive coverage of the topic."
"Mastering 3D Printing, 2nd Edition",http://www.allitebooks.com/mastering-3d-printing-2nd-edition/, Ben Lopatin, 148425631X, 2020, 183, English, Python,"Book Description:        Develop standalone Django apps to serve as the reusable building blocks for larger Django projects. This book explores best practices for publishing these apps, with special considerations for testing Django apps, and strategies for extracting existing functionality into a separate package.  This jumpstart reference is divided into four distinct and sequential sections, all containing short, engaging chapters that can be read in a modular fashion, depending on your level of experience. The first section covers the structure and scope of standalone Django apps. The second section digs into questions about pulling code out of existing projects and into new standalone apps for reuse. The third section details additional, advanced technical best practices toward making standalone apps as broadly useful as possible. The fourth and final section covers strategies for managing a published Django app.   Django Standalone Apps is the perfect resource for developers who have at least some prior experience working with Django web applications and want to simplify their deployments and share their knowledge as open source packages.   What You’ll Learn      Scope a standalone Django app project for optimum usefulness   Extract code from existing projects to reuse   Test a standalone app outside of your Django project   Reuse your own code for increased delivery cadence and code quality   Review best practices for maintaining a Django app package   Who This Book Is For    Professional developers who work with Django. Deep expertise is not required or expected, but readers should have working familiarity with Django."
Unlocking Blockchain on Azure,http://www.allitebooks.com/unlocking-blockchain-on-azure/," Benjamin Weissman, Enrico Van De Laar", 148425984X, 2020, 277, English, SQL,"Book Description:        Use this guide to one of SQL Server 2019’s most impactful features―Big Data Clusters. You will learn about data virtualization and data lakes for this complete artificial intelligence (AI) and machine learning (ML) platform within the SQL Server database engine. You will know how to use Big Data Clusters to combine large volumes of streaming data for analysis along with data stored in a traditional database. For example, you can stream large volumes of data from Apache Spark in real time while executing Transact-SQL queries to bring in relevant additional data from your corporate, SQL Server database.   Filled with clear examples and use cases, this book provides everything necessary to get started working with Big Data Clusters in SQL Server 2019. You will learn about the architectural foundations that are made up from Kubernetes, Spark, HDFS, and SQL Server on Linux. You then are shown how to configure and deploy Big Data Clusters in on-premises environments or in the cloud. Next, you are taught about querying. You will learn to write queries in Transact-SQL―taking advantage of skills you have honed for years―and with those queries you will be able to examine and analyze data from a wide variety of sources such as Apache Spark.  Through the theoretical foundation provided in this book and easy-to-follow example scripts and notebooks, you will be ready to use and unveil the full potential of SQL Server 2019: combining different types of data spread across widely disparate sources into a single view that is useful for business intelligence and machine learning analysis.    What You Will Learn     Install, manage, and troubleshoot Big Data Clusters in cloud or on-premise environments Analyze large volumes of data directly from SQL Server and/or Apache Spark Manage data stored in HDFS from SQL Server as if it were relational data Implement advanced analytics solutions through machine learning and AI Expose different data sources as a single logical source using data virtualization     Who This Book Is For   Data engineers, data scientists, data architects, and database administrators who want to employ data virtualization and big data analytics in their environments"
Unlocking Blockchain on Azure,http://www.allitebooks.com/unlocking-blockchain-on-azure/," Forbes Guthrie, Josh Atwell, Matt Liebowitz, Nick Marshall, Scott Lowe", 9781118661147, 2013, 840, English, Cloud Computing,"Book Description:        The 2013 edition of the bestselling vSphere book on the market Virtualization remains the hottest trend in the IT world, and VMware vSphere is the industry’s most widely deployed virtualization solution. The demand for IT professionals skilled in virtualization and cloud-related technologies is great and expected to keep growing. This comprehensive Sybex guide covers all the features and capabilities of VMware vSphere, showing administrators step by step how to install, configure, operate, manage, and secure it. This perfect blend of hands-on instruction, conceptual explanation, and practical application is reinforced with real-world examples. Led by Scott Lowe and Nick Marshall, both VMware vExperts, the author team provides expertise that will prepare IT professionals to excel in using this virtualization technology.  Virtualization is seen as a “best practice” for high availability and disaster recovery solutions, as well as for applications such as Exchange Server and SharePoint IDC estimates that there are as many as 7 million jobs available worldwide in virtualization and cloud technology Provides hands-on instruction in all the latest features and capabilities of VMware vSphere, with both conceptual explanations and practical applications Author team is lead by Scott Lowe and Nick Marshall, well-known VMware experts and popular bloggers  Mastering VMware vSphere provides what every virtualization professional needs to know."
Unlocking Blockchain on Azure,http://www.allitebooks.com/unlocking-blockchain-on-azure/, Shilpa Karkeraa, 1484250427, 2020, 331, English, Hardware & DIY,"Book Description:        Design, architect, and build Blockchain applications with Azure in industrial scenarios to revolutionize conventional processes and data security. This book will empower you to build better decentralized applications that have stronger encryption, better architectures, and effective deployment structures over the cloud.  You’ll start with an overview of Blockchain, distributed networks, Azure components in Blockchain, such as Azure Workbench, and independent Blockchain-as-a-service solutions. Next, you’ll move on to aspects of Blockchain transactions where the author discusses encryption and distribution along with practical examples. You’ll cover permissioned Blockchains and distributed ledgers with the help of use cases of financial institutions, followed by code and development aspects of smart contracts. Here, you will learn how to utilise the templates provided by Azure Resource Manager to quickly develop an Ethereum-based smart contract.  Further, you will go through Blockchain points of integration, where the author demonstrates enterprise integration, automated processing of smart contracts, and lifecycle events. Finally, you will go through every deployment of HyperLedger, Ethereum, and other decentralized ledger examples over Azure, thus understanding the elements of creation, design, development, security, and deployment.  After reading Unlocking Blockchain on Azure you will be able to design and develop Blockchain applications in Azure to decentralize social networks, financial organisations, and data. You’ll be able to implement encryption over a Blockchain and have full control over shared instances digitally. You will be able to program smart contracts to digitize rules and trigger timely transactions.  What You Will Learn  Build decentralized applications Program, design, and deploy dynamic smart contracts Model Blockchains in the form of token economics, hybrid networks, and infrastructure Develop end-to-end encryption and distributed systems   Who This Book Is For  Developers and solutions architects who want to develop Blockchain applications in Azure and decentralize applications in different scenarios."
Unlocking Blockchain on Azure,http://www.allitebooks.com/unlocking-blockchain-on-azure/," Ben Piper, Sara Perrott", 1119622727, 2020, 336, English, Certification,"Book Description:        Study and prepare for the AWS Certified SysOps Administrator Associate (SOA-C01) Exam You can prepare for test success with AWS Certified SysOps Administrator Practice Tests: Associate (SOA-C01) Exam. It provides a total of 1,000 practice questions that get you ready for the exam. The majority of questions are found within seven practice tests, which correspond to the seven AWS Certified SysOps Administrator Associate SOA-C01 Exam objective domains. Additionally, you can take advantage of an extra practice exam, or utilize an online test bank as an additional study resource. Practice tests allow you to demonstrate your knowledge and ability to:  Deploy, manage, and operate scalable and fault-tolerant systems on the service Implement and control data flow as it goes to and from AWS Choose the right AWS service depending upon requirements Identify the proper use of AWS best practices during operations Estimate AWS costs and pinpoint cost controls Migrate workloads to Amazon Web Services  As someone working to deliver cloud-based solutions, you can earn an AWS Certification to demonstrate your expertise with the technology. The certification program recognizes proficiency in technical skills and knowledge related to best practices for building cloud-based applications with AWS."
Unlocking Blockchain on Azure,http://www.allitebooks.com/unlocking-blockchain-on-azure/, Roger Villela, 1484258711, 2020, 188, English, C & C++,"Book Description:        Take full advantage of the .NET APIs in System.IO to achieve fundamental I/O operations and produce better quality software. You’ll start with the basics of creating a .NET Core custom library for System.IO. You will learn the purpose and benefits of a custom cross-platform .NET Core library along with the implementation architecture of the custom library components. Moving forward, you will learn how to use the .NET APIs of System.IO for getting information about resources. Here, you will go through drives, directories, files, and much more in the .NET API. You’ll discuss manipulation of resources and the environment, where you will learn how to build custom IO actions for resource manipulation followed by its properties and security. Next, you will learn special .NET API operations with System.IO with demonstrations on working with collection of resources, directories, files, and system information. Finally, you will go through the managed and unmanaged streams in the .NET API such as memory stream, file stream, and much more. After reading Understanding System.IO for .NET Core 3, you will be able to work with different features of .System.IO in .NET Core and implement its internal and commercial tools for different I/O scenarios. What You Will Learn  Discover the inner workings of the System.IO BCL implementation on the .NET Core platform Work with System.IO mechanisms available through the .NET Core platform Write a custom library that encapsulates .NET APIs  from System.IO   Design and implement various tools in System.IO Who This Book Is For  Developers with prior experience of working in .NET or .NET Core."
Unlocking Blockchain on Azure,http://www.allitebooks.com/unlocking-blockchain-on-azure/," Christopher Pitt, Joe Mancuso", 1484256018, 2020, 221, English, Python,"Book Description:        Build fast and effective applications using Masonite, a Python-based framework. This book covers creating a digital home assistant application, but it’s certainly not the only kind of application you could build. By working on this kind of project, you’ll cover the broad range of topics and requirements you’re likely to find as you establish your own web empire. You’ll see how Masonite is a developer-centric Python framework, which provides all the tools you’ll need to build powerful and maintainable web applications. After reading and using this book, you’ll have the tools to make and deploy your own web ecommerce application from scratch using the Masonite framework. What You Will Learn  Customize your request and response cycle with middleware, route groups, and headers Add security into your application and protect against possible vulnerabilities Create and control your application’s maintenance features from a terminal Manage a database, so your teammates and environments will always be in sync Represent relational database data with object-oriented programming techniques Read and write from the file system Process large datasets and slow operations in the background Add real-time features and recurring tasks to your application  Who This Book Is For Web developers new to the Masonite framework. Some prior Python experience is helpful but is not required."
Unlocking Blockchain on Azure,http://www.allitebooks.com/unlocking-blockchain-on-azure/, Dan Osipov, 1847198481, 2020, 228, English, CMS,"Book Description:        The TYPO3 Multimedia Cookbook presents over 50 effective recipes for managing multimedia in your TYPO3 site. Each recipe comprises step-by-step instructions followed by the analysis of what was done in each task and any relevant information. The book is designed so that you can refer to it chapter by chapter, or you can look at the list of recipes and read them in no particular order. The book has recipes to tackle specific problems along with detailed explanations that will help you to customize the recipes as per your individual needs. Since learning comes from doing, the reader is encouraged to follow along with the examples using the book as a practical guide. This book is for anyone who is looking for effective systems for managing multimedia content. You will find this book interesting if you are running, or starting, web sites rich in multimedia content. This book assumes some prior knowledge about TYPO3, which is available either from official documentation, or other books on this topic."
Unlocking Blockchain on Azure,http://www.allitebooks.com/unlocking-blockchain-on-azure/, Peter Himschoot, 1484259270, 2020, 303, English, C & C++,"Book Description:         Build web applications in C# and Microsoft .NET that run in any modern browser. This second edition is updated to work with the release version of Blazor and covers Blazor’s use in creating both server-side and WebAssembly Blazor applications. Developers are able to use all their experience in .NET along with thousands of existing libraries, right in the browser.  There is important new coverage in this edition on the new and improved Razor syntax, how to easily validate user input with Blazor validation, and how to build complex interacting components with Cascading Properties and Templated Components. You will learn how to build user interfaces and present data to a user for display and modification, capturing the user’s changes via data binding. The book shows you how to access a rich library of .NET functionality such as a component model for building a composable user interface, including how to develop reusable components that can be used across many pages and websites. Also covered is data exchange with a server, giving you access to microservices and database services.   Blazor provides a fresh take on web development by eliminating the need for you to learn different languages and frameworks for client- and server-side development. Blazor allows C# and .NET to be used on all sides, providing a robust feature set that is well suited toward scalable, enterprise-level applications. This book gets you started using this important new toolkit for web application development.     What You Will Learn     Build user interfaces and display data for users to edit Capture the user’s changes via data binding Transfer data back and forth between server and client Communicate with microservices and database services Develop reusable components and assemble them into bigger components Use routing to build single-page applications (SPAs) Build Blazor libraries that are reusable across applications     Who This Book Is For   Experienced .NET developers who want to apply their existing skills toward building professional-quality, client-side web applications that run in any browser. The book is for web developers who want to step away from JavaScript and its complexities, and instead use a proven technology (.NET) that is robust toward creating enterprise-quality applications that scale and are reliable, that provide good user experience."
